{
  "schema_version": "1.0.0",
  "id": "SWG-0103",
  "title": "Default-deny with single-host exception for news.example.test",
  "administrator_requirement": "Under default-deny, permit exactly one destination 'news.example.test'; all others denied.",
  "enterprise_validity_rationale": "Minimal allow-listing under Zero Trust is a standard enterprise pattern.",
  "comparable_product_capability": "Default deny + allow-list",
  "capabilities": [
    "default_deny",
    "url_domain_objects",
    "http",
    "https_connect"
  ],
  "semantic_fingerprint": "1b1efd730c4be716",
  "notes": "",
  "preconditions": {
    "baseline": "fresh /data + open-mode",
    "fixtures": "local origin_server on 192.0.2.2 (HTTP 18091 / HTTPS 18453), /etc/hosts routing",
    "network_topology": "single-node Culvert; TEST-NET-1 fixture; two client sources (192.0.2.2 corp / 127.0.0.1 guest)",
    "requires_auth": false
  },
  "intent": {
    "default_action": "deny",
    "default_auth": "Exempt",
    "rules": [
      {
        "name": "permit",
        "priority": 10,
        "kind": "access",
        "match": {
          "fqdn": "news.example.test"
        },
        "action": "allow"
      }
    ]
  },
  "expected_culvert_objects": {
    "categories": [],
    "category_groups": [],
    "decryption_profiles": [],
    "blocklist": [],
    "ssl_bypass": [],
    "access_rules": [
      "permit"
    ],
    "default_action": "deny",
    "default_auth": "Exempt"
  },
  "configuration_steps": [
    {
      "method": "POST",
      "path": "/api/default-action",
      "req": {
        "action": "deny"
      },
      "status": 200,
      "resp_head": "{\"defaultAction\":\"deny\"}\n"
    },
    {
      "method": "POST",
      "path": "/api/policy",
      "req": {
        "name": "permit",
        "priority": 10,
        "sourceIP": "",
        "sourceIdentity": "",
        "sourceGroup": "",
        "authSource": "",
        "destFQDN": "news.example.test",
        "destCategory": "",
        "destCategoryGroup": "",
        "action": "Allow",
        "sslAction": ""
      },
      "status": 200,
      "resp_head": "{\"priority\":10,\"name\":\"permit\",\"sourceIP\":\"\",\"sourceIdentity\":\"\",\"sourceGroup\":\"\",\"authSource\":\"\",\"destFQDN\":\"news.example.test\",\"destCategory\":\"\",\"destCategoryGroup\":\"\",\"destCountry\":null,\"sslAction\":\"\",\"fileFiltering\":false,\"fileProfile\":\"\",\"logFullUri\":false,\"tlsSkipVerify\":false,\"action\":\"Allow\",\"redirectURL\":\"\",\"enabled\":true,\"id\":\"01KXC9XSKDEAF84DK644KX3V45\",\"hitCount\":0,\"createdAt\":\"2026-07"
    },
    {
      "method": "GET",
      "path": "/api/policy",
      "req": null,
      "status": 200,
      "resp_head": "{\"count\":1,\"rules\":[{\"priority\":10,\"name\":\"permit\",\"sourceIP\":\"\",\"sourceIdentity\":\"\",\"sourceGroup\":\"\",\"authSource\":\"\",\"destFQDN\":\"news.example.test\",\"destCategory\":\"\",\"destCategoryGroup\":\"\",\"destCountry\":null,\"sslAction\":\"\",\"fileFiltering\":false,\"fileProfile\":\"\",\"logFullUri\":false,\"tlsSkipVerify\":false,\"action\":\"Allow\",\"redirectURL\":\"\",\"enabled\":true,\"id\":\"01KXC9XSKDEAF84DK644KX3V45\",\"hitCount\":0,"
    },
    {
      "method": "GET",
      "path": "/api/config/export",
      "req": null,
      "status": 200,
      "resp_head": "{\"version\":1,\"exportedAt\":\"2026-07-12T23:17:16Z\",\"blocklistMode\":\"block\",\"blocklist\":[],\"policyRules\":[{\"priority\":10,\"name\":\"permit\",\"sourceIP\":\"\",\"sourceIdentity\":\"\",\"sourceGroup\":\"\",\"authSource\":\"\",\"destFQDN\":\"news.example.test\",\"destCategory\":\"\",\"destCategoryGroup\":\"\",\"destCountry\":null,\"sslAction\":\"\",\"fileFiltering\":false,\"fileProfile\":\"\",\"logFullUri\":false,\"tlsSkipVerify\":false,\"action\":\"All"
    }
  ],
  "apply_report": {
    "errors": [],
    "warnings": [],
    "created": [],
    "post_apply": [],
    "readback": {
      "persisted_rules": 1,
      "expected_rules": 1,
      "mismatches": []
    }
  },
  "effective_config_excerpt": {
    "defaultAction": "deny",
    "policyRules": [
      {
        "priority": 10,
        "name": "permit",
        "sourceIP": "",
        "sourceIdentity": "",
        "sourceGroup": "",
        "authSource": "",
        "destFQDN": "news.example.test",
        "destCategory": "",
        "destCategoryGroup": "",
        "destCountry": null,
        "sslAction": "",
        "fileFiltering": false,
        "fileProfile": "",
        "logFullUri": false,
        "tlsSkipVerify": false,
        "action": "Allow",
        "redirectURL": "",
        "enabled": true,
        "id": "01KXC9XSKDEAF84DK644KX3V45",
        "hitCount": 0,
        "createdAt": "2026-07-12T23:17:16Z",
        "modifiedAt": "2026-07-12T23:17:16Z",
        "modifiedBy": "unknown"
      }
    ],
    "blocklist": [],
    "sslBypass": []
  },
  "test_vectors": [
    {
      "vector": {
        "id": "p",
        "scheme": "http",
        "host": "news.example.test",
        "client_ip": "127.0.0.1"
      },
      "expected": {
        "disposition": "allow",
        "tls": null,
        "matched_rule": "permit",
        "http_status_family": "2xx",
        "certainty": "deterministic",
        "rationale": "Rule 'permit' action=Allow.",
        "notes": []
      },
      "actual": {
        "disposition": "allow",
        "tls": null,
        "http_status": 200,
        "curl_exit": 0,
        "body_head": "origin:news.example.test\n",
        "is_block_page": false,
        "decision_trace": [
          "[Culvert] 2026/07/12 23:17:16 POLICY_ALLOW rule=\"permit\" pri=10 127.0.0.1 GET \"news.example.test:18091\" [destFQDN=news.example.test] {req_id=3501bd268a8f6c52 identity= rule=permit action=allow}"
        ],
        "stats_delta": {
          "total": 1,
          "blocked": 0,
          "allowed": 1
        },
        "probes": {}
      },
      "verdict": {
        "verdict": "PASS",
        "primary": "PASS",
        "confidence": 0.95,
        "reason": "actual 'allow' matches expected 'allow'"
      }
    },
    {
      "vector": {
        "id": "pc",
        "scheme": "https",
        "host": "news.example.test",
        "client_ip": "127.0.0.1"
      },
      "expected": {
        "disposition": "allow",
        "tls": "tls_passthrough",
        "matched_rule": "permit",
        "http_status_family": "2xx",
        "certainty": "deterministic",
        "rationale": "Rule 'permit' action=Allow.",
        "notes": []
      },
      "actual": {
        "disposition": "allow",
        "tls": "tls_passthrough",
        "http_status": 200,
        "curl_exit": 0,
        "body_head": "origin:news.example.test\n",
        "is_block_page": false,
        "decision_trace": [
          "[Culvert] 2026/07/12 23:17:17 POLICY_ALLOW rule=\"permit\" pri=10 127.0.0.1 CONNECT \"news.example.test:18453\" [destFQDN=news.example.test] {req_id=3bfbf1a081504d92 identity= rule=permit action=allow}",
          "[Culvert] 2026/07/12 23:17:17 POLICY_ALLOW rule=\"permit\" pri=10 127.0.0.1 CONNECT \"news.example.test:18453\" [destFQDN=news.example.test] {req_id=7cab6b39e4d936ad identity= rule=permit action=allow}"
        ],
        "stats_delta": {
          "total": 2,
          "blocked": 0,
          "allowed": 2
        },
        "probes": {
          "culvert_ca": {
            "rc": 60,
            "status": 0,
            "err": ""
          },
          "fixture_ca": {
            "rc": 0,
            "status": 200,
            "err": ""
          }
        }
      },
      "verdict": {
        "verdict": "PASS",
        "primary": "PASS",
        "confidence": 0.95,
        "reason": "actual 'allow' matches expected 'allow'"
      }
    },
    {
      "vector": {
        "id": "d",
        "scheme": "http",
        "host": "app.corp.local",
        "client_ip": "127.0.0.1"
      },
      "expected": {
        "disposition": "block_page",
        "tls": null,
        "matched_rule": null,
        "http_status_family": "403",
        "certainty": "deterministic",
        "rationale": "No access rule matched and Stage-2 default is deny (Zero Trust): proxy serves POLICY_DEFAULT_DENY block page.",
        "notes": []
      },
      "actual": {
        "disposition": "block_page",
        "tls": null,
        "http_status": 403,
        "curl_exit": 0,
        "body_head": "<!DOCTYPE html>\n<html lang=\"en\">\n<head>\n<meta charset=\"UTF-8\">\n<meta name=\"viewport\" content=\"width=device-width, initial-scale=1.0\">\n<title>Access Denied \u2014 Culvert</title>\n<style>\n*,*::before,*::after{box-sizing:border-box;margin:0;padding:0}\nbody{font-family:'Segoe UI',system-ui,-apple-system,sans",
        "is_block_page": true,
        "decision_trace": [
          "[Culvert] 2026/07/12 23:17:17 POLICY_DEFAULT_DENY 127.0.0.1 GET \"app.corp.local:18091\" {req_id=cfc049f88145f52a identity= action=deny}"
        ],
        "stats_delta": {
          "total": 1,
          "blocked": 1,
          "allowed": 0
        },
        "probes": {}
      },
      "verdict": {
        "verdict": "PASS",
        "primary": "PASS",
        "confidence": 0.95,
        "reason": "actual 'block_page' matches expected 'block_page'"
      }
    }
  ],
  "result_classification": "PASS",
  "confidence_score": 0.95,
  "cleanup_procedure": "API reset_config (delete rules, default-action allow) or fresh /data wipe + process restart between scenarios; fresh restart for bug confirmation.",
  "reproduction": {
    "env": {
      "culvert_commit": "2b9ade66340e652911472c7dbacea2151bf4c5fe",
      "binary": "/home/user/Culvert/culvert",
      "binary_mtime": "2026-07-12T22:19:19.133687+00:00",
      "fixture_ip": "192.0.2.2",
      "proxy": "http://127.0.0.1:18080",
      "ui": "http://127.0.0.1:19090",
      "captured_at": "2026-07-12T23:14:33.303507+00:00"
    },
    "how": "python3 edge-case-lab/harness/repro_one.py SWG-0103"
  },
  "executed_at": "2026-07-12T23:17:17.764813+00:00"
}