{
  "schema_version": "1.0.0",
  "id": "SWG-0094",
  "title": "Block HTTPS (CONNECT) to app.corp.local",
  "administrator_requirement": "Deny the CONNECT tunnel to 'app.corp.local:443'-class destinations with a policy block, independent of plain-HTTP handling.",
  "enterprise_validity_rationale": "CONNECT-tunnel destination control is required for HTTPS egress governance.",
  "comparable_product_capability": "HTTPS CONNECT policy",
  "capabilities": [
    "https_connect",
    "url_domain_objects",
    "rule_first_match"
  ],
  "semantic_fingerprint": "fa3adc817354d92f",
  "notes": "",
  "preconditions": {
    "baseline": "fresh /data + open-mode",
    "fixtures": "local origin_server on 192.0.2.2 (HTTP 18091 / HTTPS 18453), /etc/hosts routing",
    "network_topology": "single-node Culvert; TEST-NET-1 fixture; two client sources (192.0.2.2 corp / 127.0.0.1 guest)",
    "requires_auth": false
  },
  "intent": {
    "default_action": "allow",
    "default_auth": "Exempt",
    "rules": [
      {
        "name": "block-connect",
        "priority": 10,
        "kind": "access",
        "match": {
          "fqdn": "app.corp.local"
        },
        "action": "block_page"
      }
    ]
  },
  "expected_culvert_objects": {
    "categories": [],
    "category_groups": [],
    "decryption_profiles": [],
    "blocklist": [],
    "ssl_bypass": [],
    "access_rules": [
      "block-connect"
    ],
    "default_action": "allow",
    "default_auth": "Exempt"
  },
  "configuration_steps": [
    {
      "method": "POST",
      "path": "/api/default-action",
      "req": {
        "action": "allow"
      },
      "status": 200,
      "resp_head": "{\"defaultAction\":\"allow\"}\n"
    },
    {
      "method": "POST",
      "path": "/api/policy",
      "req": {
        "name": "block-connect",
        "priority": 10,
        "sourceIP": "",
        "sourceIdentity": "",
        "sourceGroup": "",
        "authSource": "",
        "destFQDN": "app.corp.local",
        "destCategory": "",
        "destCategoryGroup": "",
        "action": "Block_Page",
        "sslAction": ""
      },
      "status": 200,
      "resp_head": "{\"priority\":10,\"name\":\"block-connect\",\"sourceIP\":\"\",\"sourceIdentity\":\"\",\"sourceGroup\":\"\",\"authSource\":\"\",\"destFQDN\":\"app.corp.local\",\"destCategory\":\"\",\"destCategoryGroup\":\"\",\"destCountry\":null,\"sslAction\":\"\",\"fileFiltering\":false,\"fileProfile\":\"\",\"logFullUri\":false,\"tlsSkipVerify\":false,\"action\":\"Block_Page\",\"redirectURL\":\"\",\"enabled\":true,\"id\":\"01KXC9XD0Q28WZ5RKBBBKGQKHF\",\"hitCount\":0,\"createdAt\""
    },
    {
      "method": "GET",
      "path": "/api/policy",
      "req": null,
      "status": 200,
      "resp_head": "{\"count\":1,\"rules\":[{\"priority\":10,\"name\":\"block-connect\",\"sourceIP\":\"\",\"sourceIdentity\":\"\",\"sourceGroup\":\"\",\"authSource\":\"\",\"destFQDN\":\"app.corp.local\",\"destCategory\":\"\",\"destCategoryGroup\":\"\",\"destCountry\":null,\"sslAction\":\"\",\"fileFiltering\":false,\"fileProfile\":\"\",\"logFullUri\":false,\"tlsSkipVerify\":false,\"action\":\"Block_Page\",\"redirectURL\":\"\",\"enabled\":true,\"id\":\"01KXC9XD0Q28WZ5RKBBBKGQKHF\",\"hit"
    },
    {
      "method": "GET",
      "path": "/api/config/export",
      "req": null,
      "status": 200,
      "resp_head": "{\"version\":1,\"exportedAt\":\"2026-07-12T23:17:04Z\",\"blocklistMode\":\"block\",\"blocklist\":[],\"policyRules\":[{\"priority\":10,\"name\":\"block-connect\",\"sourceIP\":\"\",\"sourceIdentity\":\"\",\"sourceGroup\":\"\",\"authSource\":\"\",\"destFQDN\":\"app.corp.local\",\"destCategory\":\"\",\"destCategoryGroup\":\"\",\"destCountry\":null,\"sslAction\":\"\",\"fileFiltering\":false,\"fileProfile\":\"\",\"logFullUri\":false,\"tlsSkipVerify\":false,\"action\":"
    }
  ],
  "apply_report": {
    "errors": [],
    "warnings": [],
    "created": [],
    "post_apply": [],
    "readback": {
      "persisted_rules": 1,
      "expected_rules": 1,
      "mismatches": []
    }
  },
  "effective_config_excerpt": {
    "defaultAction": "allow",
    "policyRules": [
      {
        "priority": 10,
        "name": "block-connect",
        "sourceIP": "",
        "sourceIdentity": "",
        "sourceGroup": "",
        "authSource": "",
        "destFQDN": "app.corp.local",
        "destCategory": "",
        "destCategoryGroup": "",
        "destCountry": null,
        "sslAction": "",
        "fileFiltering": false,
        "fileProfile": "",
        "logFullUri": false,
        "tlsSkipVerify": false,
        "action": "Block_Page",
        "redirectURL": "",
        "enabled": true,
        "id": "01KXC9XD0Q28WZ5RKBBBKGQKHF",
        "hitCount": 0,
        "createdAt": "2026-07-12T23:17:03Z",
        "modifiedAt": "2026-07-12T23:17:03Z",
        "modifiedBy": "unknown"
      }
    ],
    "blocklist": [],
    "sslBypass": []
  },
  "test_vectors": [
    {
      "vector": {
        "id": "c",
        "scheme": "https",
        "host": "app.corp.local",
        "client_ip": "127.0.0.1"
      },
      "expected": {
        "disposition": "block_page",
        "tls": null,
        "matched_rule": "block-connect",
        "http_status_family": "403",
        "certainty": "deterministic",
        "rationale": "Rule 'block-connect' action=Block_Page.",
        "notes": []
      },
      "actual": {
        "disposition": "block_page",
        "tls": null,
        "http_status": 0,
        "curl_exit": 56,
        "body_head": "<!DOCTYPE html>\n<html lang=\"en\">\n<head>\n<meta charset=\"UTF-8\">\n<meta name=\"viewport\" content=\"width=device-width, initial-scale=1.0\">\n<title>Access Denied \u2014 Culvert</title>\n<style>\n*,*::before,*::after{box-sizing:border-box;margin:0;padding:0}\nbody{font-family:'Segoe UI',system-ui,-apple-system,sans",
        "is_block_page": true,
        "decision_trace": [
          "[Culvert] 2026/07/12 23:17:04 POLICY_BLOCK rule=\"block-connect\" pri=10 127.0.0.1 -> \"app.corp.local\" [destFQDN=app.corp.local] {req_id=0a84e0cbf3ef8680 identity= rule=block-connect action=block}",
          "[Culvert] 2026/07/12 23:17:04 POLICY_BLOCK rule=\"block-connect\" pri=10 127.0.0.1 -> \"app.corp.local\" [destFQDN=app.corp.local] {req_id=41688e18eb124146 identity= rule=block-connect action=block}"
        ],
        "stats_delta": {
          "total": 2,
          "blocked": 2,
          "allowed": 0
        },
        "probes": {
          "culvert_ca": {
            "rc": 56,
            "status": 0,
            "err": ""
          },
          "fixture_ca": {
            "rc": 56,
            "status": 0,
            "err": ""
          }
        }
      },
      "verdict": {
        "verdict": "PASS",
        "primary": "PASS",
        "confidence": 0.95,
        "reason": "actual 'block_page' matches expected 'block_page'"
      }
    }
  ],
  "result_classification": "PASS",
  "confidence_score": 0.95,
  "cleanup_procedure": "API reset_config (delete rules, default-action allow) or fresh /data wipe + process restart between scenarios; fresh restart for bug confirmation.",
  "reproduction": {
    "env": {
      "culvert_commit": "2b9ade66340e652911472c7dbacea2151bf4c5fe",
      "binary": "/home/user/Culvert/culvert",
      "binary_mtime": "2026-07-12T22:19:19.133687+00:00",
      "fixture_ip": "192.0.2.2",
      "proxy": "http://127.0.0.1:18080",
      "ui": "http://127.0.0.1:19090",
      "captured_at": "2026-07-12T23:14:33.303507+00:00"
    },
    "how": "python3 edge-case-lab/harness/repro_one.py SWG-0094"
  },
  "executed_at": "2026-07-12T23:17:04.311676+00:00"
}