{
  "schema_version": "1.0.0",
  "id": "SWG-0052",
  "title": "Block guest network from files.corp.local",
  "administrator_requirement": "Block the guest/unmanaged source network from 'files.corp.local' while corporate keeps access.",
  "enterprise_validity_rationale": "Guest-network egress restriction is a common SWG location policy.",
  "comparable_product_capability": "Source IP/zone policy",
  "capabilities": [
    "source_ip_subnet",
    "http",
    "rule_first_match"
  ],
  "semantic_fingerprint": "bd60dac29819eaaa",
  "notes": "",
  "preconditions": {
    "baseline": "fresh /data + open-mode",
    "fixtures": "local origin_server on 192.0.2.2 (HTTP 18091 / HTTPS 18453), /etc/hosts routing",
    "network_topology": "single-node Culvert; TEST-NET-1 fixture; two client sources (192.0.2.2 corp / 127.0.0.1 guest)",
    "requires_auth": false
  },
  "intent": {
    "default_action": "allow",
    "default_auth": "Exempt",
    "rules": [
      {
        "name": "guest-block",
        "priority": 10,
        "kind": "access",
        "match": {
          "src_ip": "127.0.0.0/8",
          "fqdn": "files.corp.local"
        },
        "action": "block_page"
      }
    ]
  },
  "expected_culvert_objects": {
    "categories": [],
    "category_groups": [],
    "decryption_profiles": [],
    "blocklist": [],
    "ssl_bypass": [],
    "access_rules": [
      "guest-block"
    ],
    "default_action": "allow",
    "default_auth": "Exempt"
  },
  "configuration_steps": [
    {
      "method": "POST",
      "path": "/api/default-action",
      "req": {
        "action": "allow"
      },
      "status": 200,
      "resp_head": "{\"defaultAction\":\"allow\"}\n"
    },
    {
      "method": "POST",
      "path": "/api/policy",
      "req": {
        "name": "guest-block",
        "priority": 10,
        "sourceIP": "127.0.0.0/8",
        "sourceIdentity": "",
        "sourceGroup": "",
        "authSource": "",
        "destFQDN": "files.corp.local",
        "destCategory": "",
        "destCategoryGroup": "",
        "action": "Block_Page",
        "sslAction": ""
      },
      "status": 200,
      "resp_head": "{\"priority\":10,\"name\":\"guest-block\",\"sourceIP\":\"127.0.0.0/8\",\"sourceIdentity\":\"\",\"sourceGroup\":\"\",\"authSource\":\"\",\"destFQDN\":\"files.corp.local\",\"destCategory\":\"\",\"destCategoryGroup\":\"\",\"destCountry\":null,\"sslAction\":\"\",\"fileFiltering\":false,\"fileProfile\":\"\",\"logFullUri\":false,\"tlsSkipVerify\":false,\"action\":\"Block_Page\",\"redirectURL\":\"\",\"enabled\":true,\"id\":\"01KXC9VGWSXRAX44PA3KC2P9S9\",\"hitCount\":0,"
    },
    {
      "method": "GET",
      "path": "/api/policy",
      "req": null,
      "status": 200,
      "resp_head": "{\"count\":1,\"rules\":[{\"priority\":10,\"name\":\"guest-block\",\"sourceIP\":\"127.0.0.0/8\",\"sourceIdentity\":\"\",\"sourceGroup\":\"\",\"authSource\":\"\",\"destFQDN\":\"files.corp.local\",\"destCategory\":\"\",\"destCategoryGroup\":\"\",\"destCountry\":null,\"sslAction\":\"\",\"fileFiltering\":false,\"fileProfile\":\"\",\"logFullUri\":false,\"tlsSkipVerify\":false,\"action\":\"Block_Page\",\"redirectURL\":\"\",\"enabled\":true,\"id\":\"01KXC9VGWSXRAX44PA3KC"
    },
    {
      "method": "GET",
      "path": "/api/config/export",
      "req": null,
      "status": 200,
      "resp_head": "{\"version\":1,\"exportedAt\":\"2026-07-12T23:16:02Z\",\"blocklistMode\":\"block\",\"blocklist\":[],\"policyRules\":[{\"priority\":10,\"name\":\"guest-block\",\"sourceIP\":\"127.0.0.0/8\",\"sourceIdentity\":\"\",\"sourceGroup\":\"\",\"authSource\":\"\",\"destFQDN\":\"files.corp.local\",\"destCategory\":\"\",\"destCategoryGroup\":\"\",\"destCountry\":null,\"sslAction\":\"\",\"fileFiltering\":false,\"fileProfile\":\"\",\"logFullUri\":false,\"tlsSkipVerify\":fals"
    }
  ],
  "apply_report": {
    "errors": [],
    "warnings": [],
    "created": [],
    "post_apply": [],
    "readback": {
      "persisted_rules": 1,
      "expected_rules": 1,
      "mismatches": []
    }
  },
  "effective_config_excerpt": {
    "defaultAction": "allow",
    "policyRules": [
      {
        "priority": 10,
        "name": "guest-block",
        "sourceIP": "127.0.0.0/8",
        "sourceIdentity": "",
        "sourceGroup": "",
        "authSource": "",
        "destFQDN": "files.corp.local",
        "destCategory": "",
        "destCategoryGroup": "",
        "destCountry": null,
        "sslAction": "",
        "fileFiltering": false,
        "fileProfile": "",
        "logFullUri": false,
        "tlsSkipVerify": false,
        "action": "Block_Page",
        "redirectURL": "",
        "enabled": true,
        "id": "01KXC9VGWSXRAX44PA3KC2P9S9",
        "hitCount": 0,
        "createdAt": "2026-07-12T23:16:02Z",
        "modifiedAt": "2026-07-12T23:16:02Z",
        "modifiedBy": "unknown"
      }
    ],
    "blocklist": [],
    "sslBypass": []
  },
  "test_vectors": [
    {
      "vector": {
        "id": "guest",
        "scheme": "http",
        "host": "files.corp.local",
        "client_ip": "127.0.0.1"
      },
      "expected": {
        "disposition": "block_page",
        "tls": null,
        "matched_rule": "guest-block",
        "http_status_family": "403",
        "certainty": "deterministic",
        "rationale": "Rule 'guest-block' action=Block_Page.",
        "notes": []
      },
      "actual": {
        "disposition": "block_page",
        "tls": null,
        "http_status": 403,
        "curl_exit": 0,
        "body_head": "<!DOCTYPE html>\n<html lang=\"en\">\n<head>\n<meta charset=\"UTF-8\">\n<meta name=\"viewport\" content=\"width=device-width, initial-scale=1.0\">\n<title>Access Denied \u2014 Culvert</title>\n<style>\n*,*::before,*::after{box-sizing:border-box;margin:0;padding:0}\nbody{font-family:'Segoe UI',system-ui,-apple-system,sans",
        "is_block_page": true,
        "decision_trace": [
          "[Culvert] 2026/07/12 23:16:02 POLICY_BLOCK rule=\"guest-block\" pri=10 127.0.0.1 -> \"files.corp.local\" [srcIP=127.0.0.0/8 destFQDN=files.corp.local] {req_id=963cd807c1f112d8 identity= rule=guest-block action=block}"
        ],
        "stats_delta": {
          "total": 1,
          "blocked": 1,
          "allowed": 0
        },
        "probes": {}
      },
      "verdict": {
        "verdict": "PASS",
        "primary": "PASS",
        "confidence": 0.95,
        "reason": "actual 'block_page' matches expected 'block_page'"
      }
    },
    {
      "vector": {
        "id": "corp",
        "scheme": "http",
        "host": "files.corp.local",
        "client_ip": "192.0.2.2"
      },
      "expected": {
        "disposition": "allow",
        "tls": null,
        "matched_rule": null,
        "http_status_family": "2xx",
        "certainty": "deterministic",
        "rationale": "No access rule matched and Stage-2 default is allow: passthrough.",
        "notes": []
      },
      "actual": {
        "disposition": "allow",
        "tls": null,
        "http_status": 200,
        "curl_exit": 0,
        "body_head": "origin:files.corp.local\n",
        "is_block_page": false,
        "decision_trace": [],
        "stats_delta": {
          "total": 1,
          "blocked": 0,
          "allowed": 1
        },
        "probes": {}
      },
      "verdict": {
        "verdict": "PASS",
        "primary": "PASS",
        "confidence": 0.95,
        "reason": "actual 'allow' matches expected 'allow'"
      }
    }
  ],
  "result_classification": "PASS",
  "confidence_score": 0.95,
  "cleanup_procedure": "API reset_config (delete rules, default-action allow) or fresh /data wipe + process restart between scenarios; fresh restart for bug confirmation.",
  "reproduction": {
    "env": {
      "culvert_commit": "2b9ade66340e652911472c7dbacea2151bf4c5fe",
      "binary": "/home/user/Culvert/culvert",
      "binary_mtime": "2026-07-12T22:19:19.133687+00:00",
      "fixture_ip": "192.0.2.2",
      "proxy": "http://127.0.0.1:18080",
      "ui": "http://127.0.0.1:19090",
      "captured_at": "2026-07-12T23:14:33.303507+00:00"
    },
    "how": "python3 edge-case-lab/harness/repro_one.py SWG-0052"
  },
  "executed_at": "2026-07-12T23:16:02.998997+00:00"
}