{
  "schema_version": "1.0.0",
  "id": "SWG-0017",
  "title": "Wildcard scope boundary (no over-matching of sibling domains)",
  "administrator_requirement": "A *.corp.local block must cover corp.local subdomains only and must NOT block the unrelated example.test domain (boundary/negative test against over-broad matching).",
  "enterprise_validity_rationale": "Correct wildcard scoping (no accidental over-blocking) is a key SWG correctness property.",
  "comparable_product_capability": "URL object boundary",
  "capabilities": [
    "url_domain_objects",
    "http",
    "https_connect"
  ],
  "semantic_fingerprint": "ad51cb48ce32860c",
  "notes": "",
  "preconditions": {
    "baseline": "fresh /data + open-mode",
    "fixtures": "local origin_server on 192.0.2.2 (HTTP 18091 / HTTPS 18453), /etc/hosts routing",
    "network_topology": "single-node Culvert; TEST-NET-1 fixture; two client sources (192.0.2.2 corp / 127.0.0.1 guest)",
    "requires_auth": false
  },
  "intent": {
    "default_action": "allow",
    "default_auth": "Exempt",
    "rules": [
      {
        "name": "block-corp-wild",
        "priority": 10,
        "kind": "access",
        "match": {
          "fqdn": "*.corp.local"
        },
        "action": "block_page"
      }
    ]
  },
  "expected_culvert_objects": {
    "categories": [],
    "category_groups": [],
    "decryption_profiles": [],
    "blocklist": [],
    "ssl_bypass": [],
    "access_rules": [
      "block-corp-wild"
    ],
    "default_action": "allow",
    "default_auth": "Exempt"
  },
  "configuration_steps": [
    {
      "method": "POST",
      "path": "/api/default-action",
      "req": {
        "action": "allow"
      },
      "status": 200,
      "resp_head": "{\"defaultAction\":\"allow\"}\n"
    },
    {
      "method": "POST",
      "path": "/api/policy",
      "req": {
        "name": "block-corp-wild",
        "priority": 10,
        "sourceIP": "",
        "sourceIdentity": "",
        "sourceGroup": "",
        "authSource": "",
        "destFQDN": "*.corp.local",
        "destCategory": "",
        "destCategoryGroup": "",
        "action": "Block_Page",
        "sslAction": ""
      },
      "status": 200,
      "resp_head": "{\"priority\":10,\"name\":\"block-corp-wild\",\"sourceIP\":\"\",\"sourceIdentity\":\"\",\"sourceGroup\":\"\",\"authSource\":\"\",\"destFQDN\":\"*.corp.local\",\"destCategory\":\"\",\"destCategoryGroup\":\"\",\"destCountry\":null,\"sslAction\":\"\",\"fileFiltering\":false,\"fileProfile\":\"\",\"logFullUri\":false,\"tlsSkipVerify\":false,\"action\":\"Block_Page\",\"redirectURL\":\"\",\"enabled\":true,\"id\":\"01KXC9SMBHAFPM4H6A2WJ31CJG\",\"hitCount\":0,\"createdAt\""
    },
    {
      "method": "GET",
      "path": "/api/policy",
      "req": null,
      "status": 200,
      "resp_head": "{\"count\":1,\"rules\":[{\"priority\":10,\"name\":\"block-corp-wild\",\"sourceIP\":\"\",\"sourceIdentity\":\"\",\"sourceGroup\":\"\",\"authSource\":\"\",\"destFQDN\":\"*.corp.local\",\"destCategory\":\"\",\"destCategoryGroup\":\"\",\"destCountry\":null,\"sslAction\":\"\",\"fileFiltering\":false,\"fileProfile\":\"\",\"logFullUri\":false,\"tlsSkipVerify\":false,\"action\":\"Block_Page\",\"redirectURL\":\"\",\"enabled\":true,\"id\":\"01KXC9SMBHAFPM4H6A2WJ31CJG\",\"hit"
    },
    {
      "method": "GET",
      "path": "/api/config/export",
      "req": null,
      "status": 200,
      "resp_head": "{\"version\":1,\"exportedAt\":\"2026-07-12T23:15:00Z\",\"blocklistMode\":\"block\",\"blocklist\":[],\"policyRules\":[{\"priority\":10,\"name\":\"block-corp-wild\",\"sourceIP\":\"\",\"sourceIdentity\":\"\",\"sourceGroup\":\"\",\"authSource\":\"\",\"destFQDN\":\"*.corp.local\",\"destCategory\":\"\",\"destCategoryGroup\":\"\",\"destCountry\":null,\"sslAction\":\"\",\"fileFiltering\":false,\"fileProfile\":\"\",\"logFullUri\":false,\"tlsSkipVerify\":false,\"action\":"
    }
  ],
  "apply_report": {
    "errors": [],
    "warnings": [],
    "created": [],
    "post_apply": [],
    "readback": {
      "persisted_rules": 1,
      "expected_rules": 1,
      "mismatches": []
    }
  },
  "effective_config_excerpt": {
    "defaultAction": "allow",
    "policyRules": [
      {
        "priority": 10,
        "name": "block-corp-wild",
        "sourceIP": "",
        "sourceIdentity": "",
        "sourceGroup": "",
        "authSource": "",
        "destFQDN": "*.corp.local",
        "destCategory": "",
        "destCategoryGroup": "",
        "destCountry": null,
        "sslAction": "",
        "fileFiltering": false,
        "fileProfile": "",
        "logFullUri": false,
        "tlsSkipVerify": false,
        "action": "Block_Page",
        "redirectURL": "",
        "enabled": true,
        "id": "01KXC9SMBHAFPM4H6A2WJ31CJG",
        "hitCount": 0,
        "createdAt": "2026-07-12T23:15:00Z",
        "modifiedAt": "2026-07-12T23:15:00Z",
        "modifiedBy": "unknown"
      }
    ],
    "blocklist": [],
    "sslBypass": []
  },
  "test_vectors": [
    {
      "vector": {
        "id": "in",
        "scheme": "http",
        "host": "app.corp.local",
        "client_ip": "127.0.0.1"
      },
      "expected": {
        "disposition": "block_page",
        "tls": null,
        "matched_rule": "block-corp-wild",
        "http_status_family": "403",
        "certainty": "deterministic",
        "rationale": "Rule 'block-corp-wild' action=Block_Page.",
        "notes": []
      },
      "actual": {
        "disposition": "block_page",
        "tls": null,
        "http_status": 403,
        "curl_exit": 0,
        "body_head": "<!DOCTYPE html>\n<html lang=\"en\">\n<head>\n<meta charset=\"UTF-8\">\n<meta name=\"viewport\" content=\"width=device-width, initial-scale=1.0\">\n<title>Access Denied \u2014 Culvert</title>\n<style>\n*,*::before,*::after{box-sizing:border-box;margin:0;padding:0}\nbody{font-family:'Segoe UI',system-ui,-apple-system,sans",
        "is_block_page": true,
        "decision_trace": [
          "[Culvert] 2026/07/12 23:15:00 POLICY_BLOCK rule=\"block-corp-wild\" pri=10 127.0.0.1 -> \"app.corp.local\" [destFQDN=*.corp.local] {req_id=1c2f6fdd2894d5ea identity= rule=block-corp-wild action=block}"
        ],
        "stats_delta": {
          "total": 1,
          "blocked": 1,
          "allowed": 0
        },
        "probes": {}
      },
      "verdict": {
        "verdict": "PASS",
        "primary": "PASS",
        "confidence": 0.95,
        "reason": "actual 'block_page' matches expected 'block_page'"
      }
    },
    {
      "vector": {
        "id": "boundary",
        "scheme": "http",
        "host": "example.test",
        "client_ip": "127.0.0.1"
      },
      "expected": {
        "disposition": "allow",
        "tls": null,
        "matched_rule": null,
        "http_status_family": "2xx",
        "certainty": "deterministic",
        "rationale": "No access rule matched and Stage-2 default is allow: passthrough.",
        "notes": []
      },
      "actual": {
        "disposition": "allow",
        "tls": null,
        "http_status": 200,
        "curl_exit": 0,
        "body_head": "origin:example.test\n",
        "is_block_page": false,
        "decision_trace": [],
        "stats_delta": {
          "total": 1,
          "blocked": 0,
          "allowed": 1
        },
        "probes": {}
      },
      "verdict": {
        "verdict": "PASS",
        "primary": "PASS",
        "confidence": 0.95,
        "reason": "actual 'allow' matches expected 'allow'"
      }
    },
    {
      "vector": {
        "id": "connect-in",
        "scheme": "https",
        "host": "intranet.corp.local",
        "client_ip": "127.0.0.1"
      },
      "expected": {
        "disposition": "block_page",
        "tls": null,
        "matched_rule": "block-corp-wild",
        "http_status_family": "403",
        "certainty": "deterministic",
        "rationale": "Rule 'block-corp-wild' action=Block_Page.",
        "notes": []
      },
      "actual": {
        "disposition": "conn_fail",
        "tls": null,
        "http_status": 0,
        "curl_exit": 56,
        "body_head": "origin:example.test\n",
        "is_block_page": false,
        "decision_trace": [
          "[Culvert] 2026/07/12 23:15:01 POLICY_BLOCK rule=\"block-corp-wild\" pri=10 127.0.0.1 -> \"intranet.corp.local\" [destFQDN=*.corp.local] {req_id=3221965459e56465 identity= rule=block-corp-wild action=block}",
          "[Culvert] 2026/07/12 23:15:01 POLICY_BLOCK rule=\"block-corp-wild\" pri=10 127.0.0.1 -> \"intranet.corp.local\" [destFQDN=*.corp.local] {req_id=7253d9c9dd1d3da0 identity= rule=block-corp-wild action=block}"
        ],
        "stats_delta": {
          "total": 2,
          "blocked": 2,
          "allowed": 0
        },
        "probes": {
          "culvert_ca": {
            "rc": 56,
            "status": 0,
            "err": ""
          },
          "fixture_ca": {
            "rc": 56,
            "status": 0,
            "err": ""
          }
        }
      },
      "verdict": {
        "verdict": "PASS",
        "primary": "PASS",
        "confidence": 0.95,
        "reason": "actual 'conn_fail' matches expected 'block_page'"
      }
    }
  ],
  "result_classification": "PASS",
  "confidence_score": 0.95,
  "cleanup_procedure": "API reset_config (delete rules, default-action allow) or fresh /data wipe + process restart between scenarios; fresh restart for bug confirmation.",
  "reproduction": {
    "env": {
      "culvert_commit": "2b9ade66340e652911472c7dbacea2151bf4c5fe",
      "binary": "/home/user/Culvert/culvert",
      "binary_mtime": "2026-07-12T22:19:19.133687+00:00",
      "fixture_ip": "192.0.2.2",
      "proxy": "http://127.0.0.1:18080",
      "ui": "http://127.0.0.1:19090",
      "captured_at": "2026-07-12T23:14:33.303507+00:00"
    },
    "how": "python3 edge-case-lab/harness/repro_one.py SWG-0017"
  },
  "executed_at": "2026-07-12T23:15:01.272073+00:00"
}