{
  "schema_version": "1.0.0",
  "id": "SWG-0124",
  "title": "Policy configuration persists across a proxy restart",
  "administrator_requirement": "Policy created through the admin API must survive a data-plane process restart (durable configuration), so enforcement is not silently lost on reboot.",
  "enterprise_validity_rationale": "Configuration durability across restarts is a fundamental enterprise expectation.",
  "comparable_product_capability": "Configuration persistence",
  "capabilities": [
    "config_persistence",
    "data_plane_restart",
    "http"
  ],
  "semantic_fingerprint": "bf27edf3c3e4894f",
  "notes": "Runner restarts the process WITHOUT wiping /data, then re-evaluates the vectors.",
  "preconditions": {
    "baseline": "fresh /data + open-mode",
    "fixtures": "local origin_server on 192.0.2.2 (HTTP 18091 / HTTPS 18453), /etc/hosts routing",
    "network_topology": "single-node Culvert; TEST-NET-1 fixture; two client sources (192.0.2.2 corp / 127.0.0.1 guest)",
    "requires_auth": false
  },
  "intent": {
    "default_action": "deny",
    "default_auth": "Exempt",
    "rules": [
      {
        "name": "permit-app",
        "priority": 10,
        "kind": "access",
        "match": {
          "fqdn": "app.corp.local"
        },
        "action": "allow"
      }
    ],
    "persistence_check": true,
    "triage": {
      "class": "CONFIGURATION_CONTRACT_GAP",
      "note": "Policy created through the supported admin API is NOT durable across a data-plane restart unless the operator started Culvert with a -policy persistence file (startup logs 'Policy: in-memory only'). The API/GUI accept and enforce the rule live but give no indication it is ephemeral, so an admin who configures policy via the GUI and later restarts the proxy silently loses all of it. Durable-by-default persistence (or an explicit ephemeral warning) is the enterprise expectation."
    }
  },
  "expected_culvert_objects": {
    "categories": [],
    "category_groups": [],
    "decryption_profiles": [],
    "blocklist": [],
    "ssl_bypass": [],
    "access_rules": [
      "permit-app"
    ],
    "default_action": "deny",
    "default_auth": "Exempt"
  },
  "configuration_steps": [
    {
      "method": "POST",
      "path": "/api/default-action",
      "req": {
        "action": "deny"
      },
      "status": 200,
      "resp_head": "{\"defaultAction\":\"deny\"}\n"
    },
    {
      "method": "POST",
      "path": "/api/policy",
      "req": {
        "name": "permit-app",
        "priority": 10,
        "sourceIP": "",
        "sourceIdentity": "",
        "sourceGroup": "",
        "authSource": "",
        "destFQDN": "app.corp.local",
        "destCategory": "",
        "destCategoryGroup": "",
        "action": "Allow",
        "sslAction": ""
      },
      "status": 200,
      "resp_head": "{\"priority\":10,\"name\":\"permit-app\",\"sourceIP\":\"\",\"sourceIdentity\":\"\",\"sourceGroup\":\"\",\"authSource\":\"\",\"destFQDN\":\"app.corp.local\",\"destCategory\":\"\",\"destCategoryGroup\":\"\",\"destCountry\":null,\"sslAction\":\"\",\"fileFiltering\":false,\"fileProfile\":\"\",\"logFullUri\":false,\"tlsSkipVerify\":false,\"action\":\"Allow\",\"redirectURL\":\"\",\"enabled\":true,\"id\":\"01KXC9YTMTHD4R52SGA5HNN4KX\",\"hitCount\":0,\"createdAt\":\"2026-0"
    },
    {
      "method": "GET",
      "path": "/api/policy",
      "req": null,
      "status": 200,
      "resp_head": "{\"count\":1,\"rules\":[{\"priority\":10,\"name\":\"permit-app\",\"sourceIP\":\"\",\"sourceIdentity\":\"\",\"sourceGroup\":\"\",\"authSource\":\"\",\"destFQDN\":\"app.corp.local\",\"destCategory\":\"\",\"destCategoryGroup\":\"\",\"destCountry\":null,\"sslAction\":\"\",\"fileFiltering\":false,\"fileProfile\":\"\",\"logFullUri\":false,\"tlsSkipVerify\":false,\"action\":\"Allow\",\"redirectURL\":\"\",\"enabled\":true,\"id\":\"01KXC9YTMTHD4R52SGA5HNN4KX\",\"hitCount\":0"
    },
    {
      "method": "GET",
      "path": "/api/config/export",
      "req": null,
      "status": 200,
      "resp_head": "{\"version\":1,\"exportedAt\":\"2026-07-12T23:17:50Z\",\"blocklistMode\":\"block\",\"blocklist\":[],\"policyRules\":[{\"priority\":10,\"name\":\"permit-app\",\"sourceIP\":\"\",\"sourceIdentity\":\"\",\"sourceGroup\":\"\",\"authSource\":\"\",\"destFQDN\":\"app.corp.local\",\"destCategory\":\"\",\"destCategoryGroup\":\"\",\"destCountry\":null,\"sslAction\":\"\",\"fileFiltering\":false,\"fileProfile\":\"\",\"logFullUri\":false,\"tlsSkipVerify\":false,\"action\":\"Al"
    },
    {
      "method": "GET",
      "path": "/api/policy",
      "req": null,
      "status": 200,
      "resp_head": "{\"count\":0,\"rules\":[],\"updatedAt\":\"\",\"version\":0}\n"
    }
  ],
  "apply_report": {
    "errors": [],
    "warnings": [],
    "created": [],
    "post_apply": [],
    "readback": {
      "persisted_rules": 1,
      "expected_rules": 1,
      "mismatches": []
    },
    "persistence_after_restart": {
      "persisted_rules": 0,
      "expected_rules": 1,
      "mismatches": [
        "rule 'permit-app' did not persist"
      ]
    }
  },
  "effective_config_excerpt": {
    "defaultAction": "deny",
    "policyRules": [
      {
        "priority": 10,
        "name": "permit-app",
        "sourceIP": "",
        "sourceIdentity": "",
        "sourceGroup": "",
        "authSource": "",
        "destFQDN": "app.corp.local",
        "destCategory": "",
        "destCategoryGroup": "",
        "destCountry": null,
        "sslAction": "",
        "fileFiltering": false,
        "fileProfile": "",
        "logFullUri": false,
        "tlsSkipVerify": false,
        "action": "Allow",
        "redirectURL": "",
        "enabled": true,
        "id": "01KXC9YTMTHD4R52SGA5HNN4KX",
        "hitCount": 0,
        "createdAt": "2026-07-12T23:17:50Z",
        "modifiedAt": "2026-07-12T23:17:50Z",
        "modifiedBy": "unknown"
      }
    ],
    "blocklist": [],
    "sslBypass": []
  },
  "test_vectors": [
    {
      "vector": {
        "id": "app",
        "scheme": "http",
        "host": "app.corp.local",
        "client_ip": "127.0.0.1"
      },
      "expected": {
        "disposition": "allow",
        "tls": null,
        "matched_rule": "permit-app",
        "http_status_family": "2xx",
        "certainty": "deterministic",
        "rationale": "Rule 'permit-app' action=Allow.",
        "notes": []
      },
      "actual": {
        "disposition": "block_page",
        "tls": null,
        "http_status": 403,
        "curl_exit": 0,
        "body_head": "<!DOCTYPE html>\n<html lang=\"en\">\n<head>\n<meta charset=\"UTF-8\">\n<meta name=\"viewport\" content=\"width=device-width, initial-scale=1.0\">\n<title>Access Denied \u2014 Culvert</title>\n<style>\n*,*::before,*::after{box-sizing:border-box;margin:0;padding:0}\nbody{font-family:'Segoe UI',system-ui,-apple-system,sans",
        "is_block_page": true,
        "decision_trace": [
          "[Culvert] 2026/07/12 23:17:51 POLICY_DEFAULT_DENY 127.0.0.1 GET \"app.corp.local:18091\" {req_id=5e5a70c48d0ede96 identity= action=deny}"
        ],
        "stats_delta": {
          "total": 1,
          "blocked": 1,
          "allowed": 0
        },
        "probes": {}
      },
      "verdict": {
        "verdict": "CONFIGURATION_CONTRACT_GAP",
        "primary": "CONFIGURATION_CONTRACT_GAP",
        "confidence": 0.85,
        "reason": "expected 'allow' but actual 'block_page'. Triage: Policy created through the supported admin API is NOT durable across a data-plane restart unless the operator started Culvert with a -policy persistence file (startup logs 'Policy: in-memory only'). T"
      }
    },
    {
      "vector": {
        "id": "deny",
        "scheme": "http",
        "host": "media.corp.local",
        "client_ip": "127.0.0.1"
      },
      "expected": {
        "disposition": "block_page",
        "tls": null,
        "matched_rule": null,
        "http_status_family": "403",
        "certainty": "deterministic",
        "rationale": "No access rule matched and Stage-2 default is deny (Zero Trust): proxy serves POLICY_DEFAULT_DENY block page.",
        "notes": []
      },
      "actual": {
        "disposition": "block_page",
        "tls": null,
        "http_status": 403,
        "curl_exit": 0,
        "body_head": "<!DOCTYPE html>\n<html lang=\"en\">\n<head>\n<meta charset=\"UTF-8\">\n<meta name=\"viewport\" content=\"width=device-width, initial-scale=1.0\">\n<title>Access Denied \u2014 Culvert</title>\n<style>\n*,*::before,*::after{box-sizing:border-box;margin:0;padding:0}\nbody{font-family:'Segoe UI',system-ui,-apple-system,sans",
        "is_block_page": true,
        "decision_trace": [
          "[Culvert] 2026/07/12 23:17:51 POLICY_DEFAULT_DENY 127.0.0.1 GET \"media.corp.local:18091\" {req_id=210c07755707b92d identity= action=deny}"
        ],
        "stats_delta": {
          "total": 1,
          "blocked": 1,
          "allowed": 0
        },
        "probes": {}
      },
      "verdict": {
        "verdict": "PASS",
        "primary": "PASS",
        "confidence": 0.95,
        "reason": "actual 'block_page' matches expected 'block_page'"
      }
    }
  ],
  "result_classification": "CONFIGURATION_CONTRACT_GAP",
  "confidence_score": 0.85,
  "cleanup_procedure": "API reset_config (delete rules, default-action allow) or fresh /data wipe + process restart between scenarios; fresh restart for bug confirmation.",
  "reproduction": {
    "env": {
      "culvert_commit": "2b9ade66340e652911472c7dbacea2151bf4c5fe",
      "binary": "/home/user/Culvert/culvert",
      "binary_mtime": "2026-07-12T22:19:19.133687+00:00",
      "fixture_ip": "192.0.2.2",
      "proxy": "http://127.0.0.1:18080",
      "ui": "http://127.0.0.1:19090",
      "captured_at": "2026-07-12T23:14:33.303507+00:00"
    },
    "how": "python3 edge-case-lab/harness/repro_one.py SWG-0124"
  },
  "executed_at": "2026-07-12T23:17:51.909104+00:00"
}